catalogID,placeID,parentPlaceID,typeKeys,officialName,reading,aliases,prefecture,municipality,address,latitude,longitude,officialURL,sourceURL,capacity,status,selectionReason,verifiedAt,notes
temple,jp-kyoto-sanjusangendo,,temple|historic_site|national_treasure|landmark,蓮華王院 三十三間堂,れんげおういんさんじゅうさんげんどう,三十三間堂|Sanjusangendo,京都府,京都市東山区,京都府京都市東山区三十三間堂廻町657,,,https://www.sanjusangendo.jp/,https://www.sanjusangendo.jp/visit/,,open,千体千手観音立像と通し矢で全国的に知られる京都東山の主要寺院,2026-07-21,公式拝観案内で名称と住所を確認
temple,jp-shiga-hieizan-enryakuji,,temple|historic_site|world_heritage|national_treasure|landmark,天台宗総本山 比叡山延暦寺,てんだいしゅうそうほんざんひえいざんえんりゃくじ,延暦寺|比叡山|Hieizan Enryakuji,滋賀県,大津市,滋賀県大津市坂本本町4220,,,https://www.hieizan.or.jp/,https://www.hieizan.or.jp/about/,,open,天台宗総本山で日本仏教史と世界文化遺産を代表する比叡山の主要寺院,2026-07-21,公式寺院概要で名称と住所を確認
temple,jp-kanagawa-kamakura-kotokuin,,temple|historic_site|national_treasure|landmark,鎌倉大仏殿高徳院,かまくらだいぶつでんこうとくいん,鎌倉大仏|高徳院|Kotoku-in,神奈川県,鎌倉市,神奈川県鎌倉市長谷4-2-28,,,https://www.kotoku-in.jp/,https://www.kotoku-in.jp/?lang=ja,,open,国宝銅造阿弥陀如来坐像の鎌倉大仏で国内外から観光・参拝される鎌倉の代表寺院,2026-07-21,公式サイトの所在地案内で名称と住所を確認
temple,jp-kanagawa-kamakura-hasedera,,temple|historic_site|landmark,鎌倉 長谷寺,かまくらはせでら,長谷観音|海光山慈照院長谷寺|Kamakura Hasedera,神奈川県,鎌倉市,神奈川県鎌倉市長谷3-11-2,,,https://www.hasedera.jp/,https://www.hasedera.jp/about/,,open,長谷観音と眺望・花の寺として知られ鎌倉観光の定番となる主要寺院,2026-07-21,公式寺院案内で名称と住所を確認
temple,jp-yamagata-risshakuji-yamadera,,temple|historic_site|national_treasure|landmark,宝珠山 立石寺,ほうじゅさんりっしゃくじ,山寺|立石寺|Risshakuji,山形県,山形市,山形県山形市大字山寺4456-1,,,https://www.rissyakuji.jp/,https://www.kankou.yamagata.yamagata.jp/db/cgi-bin/search/search.cgi?c=20&d01=10086382911950&panel=detail,,open,松尾芭蕉の句と岩山の参道・五大堂で全国的に知られる山形県の代表的寺院,2026-07-21,山形市観光協会公式情報で名称・住所・施設公式URLを確認
temple,jp-iwate-motsuji,,temple|historic_site|world_heritage|special_historic_site|landmark,天台宗 別格本山 毛越寺,てんだいしゅうべっかくほんざんもうつうじ,毛越寺|Motsuji Temple,岩手県,西磐井郡平泉町,岩手県西磐井郡平泉町平泉字大沢58,,,https://motsuji.or.jp/,https://motsuji.or.jp/,,open,浄土庭園と平泉世界遺産を構成し中尊寺と並ぶ東北の代表的観光寺院,2026-07-21,施設公式サイトで寺格を含む名称と住所を確認
temple,jp-miyagi-matsushima-zuiganji,,temple|historic_site|national_treasure|landmark,国宝 瑞巌寺,こくほうずいがんじ,瑞巌寺|Zuiganji,宮城県,宮城郡松島町,宮城県宮城郡松島町松島字町内91番地,,,https://www.zuiganji.or.jp/,https://www.zuiganji.or.jp/guide/,,open,伊達政宗の菩提寺で国宝本堂を有し日本三景松島観光の中心となる主要寺院,2026-07-21,公式拝観案内で名称と住所を確認
temple,jp-aomori-osorezan-bodaiji,,temple|historic_site|sacred_site|landmark,恐山菩提寺,おそれざんぼだいじ,霊場恐山|恐山|Osorezan Bodaiji,青森県,むつ市,青森県むつ市田名部宇曽利山3-2,,,https://reijyo-osorezan.jp/,https://reijyo-osorezan.jp/access/,,open,日本三大霊場の一つとして全国的に知られ下北半島を代表する信仰・観光地,2026-07-21,恐山山主監督の公式サイトで名称・住所を確認。冬季休山は公式情報に委ねる
shrine,jp-kyoto-yasaka-jinja,,shrine|historic_site|landmark,八坂神社,やさかじんじゃ,祇園さん|Yasaka Shrine,京都府,京都市東山区,京都府京都市東山区祇園町北側625,,,https://www.yasaka-jinja.or.jp/,https://ja.kyoto.travel/tourism/single01.php?category_id=7&tourism_id=474,,open,祇園祭で全国的に知られ京都東山観光の中心となる代表的神社,2026-07-21,京都市観光協会と施設公式サイトで名称・住所を確認
shrine,jp-kyoto-heian-jingu,,shrine|historic_site|landmark,平安神宮,へいあんじんぐう,Heian Jingu,京都府,京都市左京区,京都府京都市左京区岡崎西天王町97,,,https://www.heianjingu.or.jp/,https://ja.kyoto.travel/tourism/single01.php?category_id=7&tourism_id=453,,open,大極殿を模した社殿と神苑で知られる岡崎文化エリアの主要神社,2026-07-21,京都市観光協会と施設公式サイトで名称・住所を確認
shrine,jp-kyoto-kamigamo-jinja,,shrine|historic_site|world_heritage|landmark,賀茂別雷神社（上賀茂神社）,かもわけいかづちじんじゃ,上賀茂神社|Kamigamo Jinja,京都府,京都市北区,京都府京都市北区上賀茂本山339,,,https://www.kamigamojinja.jp/,https://ja.kyoto.travel/tourism/single01.php?category_id=7&tourism_id=253,,open,京都最古級の由緒と葵祭で知られる世界文化遺産の代表的神社,2026-07-21,京都市観光協会と施設公式サイトで名称・住所を確認
shrine,jp-kyoto-shimogamo-jinja,,shrine|historic_site|world_heritage|landmark,賀茂御祖神社（下鴨神社）,かもみおやじんじゃ,下鴨神社|Shimogamo Jinja,京都府,京都市左京区,京都府京都市左京区下鴨泉川町59,,,https://www.shimogamo-jinja.or.jp/,https://ja.kyoto.travel/flower/momiji/single.php?flower_id=1210,,open,糺の森と葵祭で知られる世界文化遺産の代表的神社,2026-07-21,京都市観光協会と施設公式サイトで名称・住所を確認
shrine,jp-kyoto-kifune-jinja,,shrine|historic_site|sacred_site|landmark,貴船神社,きふねじんじゃ,きふね神社|Kifune Jinja,京都府,京都市左京区,京都府京都市左京区鞍馬貴船町180,,,https://kifunejinja.jp/,https://ja.kyoto.travel/tourism/single01.php?category_id=7&tourism_id=261,,open,水の神を祀り貴船エリアを代表する全国的に著名な神社,2026-07-21,京都市観光協会と施設公式サイトで名称・住所を確認
shrine,jp-kyoto-iwashimizu-hachimangu,,shrine|historic_site|national_treasure|landmark,石清水八幡宮,いわしみずはちまんぐう,Iwashimizu Hachimangu,京都府,八幡市,京都府八幡市八幡高坊30,,,https://iwashimizu.or.jp/,https://www.kyoto-kankou.or.jp/info_search/390,,open,日本三大八幡宮の一つで国宝社殿を有する京都南部の代表的神社,2026-07-21,京都府観光連盟と施設公式サイトで名称・住所を確認
shrine,jp-kyoto-matsunoo-taisha,,shrine|historic_site|landmark,松尾大社,まつのおたいしゃ,まつおたいしゃ|Matsunoo Taisha,京都府,京都市西京区,京都府京都市西京区嵐山宮町3,,,https://www.matsunoo.or.jp/,https://ja.kyoto.travel/tourism/single01.php?category_id=7&tourism_id=466,,open,酒造の神として広く信仰される京都西部の古社,2026-07-21,京都市観光協会と施設公式サイトで名称・住所を確認
temple,jp-kyoto-kenninji,,temple|historic_site|landmark,建仁寺,けんにんじ,建仁禅寺|Kenninji,京都府,京都市東山区,京都府京都市東山区大和大路通四条下る小松町584,,,https://www.kenninji.jp/,https://ja.kyoto.travel/tourism/single01.php?category_id=7&tourism_id=276,,open,京都最古の禅寺として祇園エリアを代表する主要寺院,2026-07-21,京都市観光協会と施設公式サイトで名称・住所を確認
temple,jp-kyoto-nanzenji,,temple|historic_site|landmark,南禅寺,なんぜんじ,Nanzenji,京都府,京都市左京区,京都府京都市左京区南禅寺福地町,,,https://nanzenji.or.jp/,https://ja.kyoto.travel/tourism/single01.php?category_id=7&tourism_id=436,,open,三門と水路閣で知られる京都を代表する禅寺,2026-07-21,京都市観光協会と施設公式サイトで名称・住所を確認
temple,jp-kyoto-ryoanji,,temple|historic_site|world_heritage|landmark,龍安寺,りょうあんじ,竜安寺|Ryoanji,京都府,京都市右京区,京都府京都市右京区龍安寺御陵下町13,,,https://www.ryoanji.jp/,https://ja.kyoto.travel/tourism/single01.php?tourism_id=482,,open,石庭で世界的に知られる世界文化遺産の禅寺,2026-07-21,京都市観光協会と施設公式サイトで名称・住所を確認
temple,jp-kyoto-ninnaji,,temple|historic_site|world_heritage|national_treasure|landmark,仁和寺,にんなじ,御室御所|Ninnaji,京都府,京都市右京区,京都府京都市右京区御室大内33,,,https://ninnaji.jp/,https://ja.kyoto.travel/tourism/single01.php?category_id=7&tourism_id=439,,open,御室桜と五重塔で知られる世界文化遺産の門跡寺院,2026-07-21,京都市観光協会と施設公式サイトで名称・住所を確認
temple,jp-kyoto-tenryuji,,temple|historic_site|world_heritage|landmark,天龍寺,てんりゅうじ,Tenryuji,京都府,京都市右京区,京都府京都市右京区嵯峨天龍寺芒ノ馬場町68,,,https://www.tenryuji.com/,https://ja.kyoto.travel/tourism/single01.php?category_id=7&tourism_id=428,,open,曹源池庭園で知られ嵐山観光の核となる世界文化遺産の禅寺,2026-07-21,京都市観光協会と施設公式サイトで名称・住所を確認
temple,jp-kyoto-toji,,temple|historic_site|world_heritage|national_treasure|landmark,教王護国寺（東寺）,きょうおうごこくじ,東寺|Toji,京都府,京都市南区,京都府京都市南区九条町1,,,https://toji.or.jp/,https://ja.kyoto.travel/tourism/single01.php?category_id=7&tourism_id=262,,open,五重塔で知られ京都駅周辺を代表する世界文化遺産の寺院,2026-07-21,京都市観光協会と施設公式サイトで名称・住所を確認
temple,jp-kyoto-nishi-hongwanji,,temple|historic_site|world_heritage|national_treasure|landmark,本願寺（西本願寺）,ほんがんじ,西本願寺|Nishi Hongwanji,京都府,京都市下京区,京都府京都市下京区堀川通花屋町下る本願寺門前町,,,https://www.hongwanji.kyoto/,https://ja.kyoto.travel/tourism/single01.php?category_id=&tourism_id=215,,open,浄土真宗本願寺派の本山で世界文化遺産を構成する主要寺院,2026-07-21,京都市観光協会と施設公式サイトで名称・住所を確認
temple,jp-kyoto-higashi-hongwanji,,temple|historic_site|landmark,真宗本廟（東本願寺）,しんしゅうほんびょう,東本願寺|Higashi Honganji,京都府,京都市下京区,京都府京都市下京区烏丸通七条上る常葉町754,,,https://www.higashihonganji.or.jp/,https://ja.kyoto.travel/tourism/single01.php?category_id=7&tourism_id=507,,open,巨大な御影堂で知られる真宗大谷派の本山,2026-07-21,京都市観光協会と施設公式サイトで名称・住所を確認
temple,jp-kyoto-daitokuji,,temple|historic_site|landmark,大徳寺,だいとくじ,龍寶山大徳寺|Daitokuji,京都府,京都市北区,京都府京都市北区紫野大徳寺町53,,,https://www.rinzaidaitoku.jp/,https://ja.kyoto.travel/tourism/single01.php?category_id=7&tourism_id=410,,open,多数の塔頭と茶の湯文化で知られる洛北の代表的禅寺,2026-07-21,京都市観光協会と施設案内で名称・住所を確認
temple,jp-kyoto-eikando,,temple|historic_site|landmark,禅林寺（永観堂）,ぜんりんじ,永観堂|Eikando,京都府,京都市左京区,京都府京都市左京区永観堂町48,,,https://www.eikando.or.jp/,https://ja.kyoto.travel/tourism/single01.php?category_id=7&tourism_id=397,,open,紅葉とみかえり阿弥陀で全国的に知られる京都東山の寺院,2026-07-21,京都市観光協会と施設公式サイトで名称・住所を確認
temple,jp-kyoto-kurama-dera,,temple|historic_site|sacred_site|landmark,鞍馬寺,くらまでら,鞍馬山|Kuramadera,京都府,京都市左京区,京都府京都市左京区鞍馬本町1074,,,https://www.kuramadera.or.jp/,https://ja.kyoto.travel/tourism/single01.php?category_id=7&tourism_id=270,,open,牛若丸伝説と山岳信仰で知られる鞍馬の代表寺院,2026-07-21,京都市観光協会と施設公式サイトで名称・住所を確認
temple,jp-kyoto-sanzenin,,temple|historic_site|landmark,三千院,さんぜんいん,三千院門跡|Sanzenin,京都府,京都市左京区,京都府京都市左京区大原来迎院町540,,,https://www.sanzenin.or.jp/,https://www.kyoto-kankou.or.jp/info_search/237,,open,苔庭と往生極楽院で知られる大原観光の代表寺院,2026-07-21,京都府観光連盟と施設公式サイトで名称・住所を確認
temple,jp-kyoto-myoshinji,,temple|historic_site|landmark,妙心寺,みょうしんじ,正法山妙心禅寺|Myoshinji,京都府,京都市右京区,京都府京都市右京区花園妙心寺町1,,,https://www.myoshinji.or.jp/,https://ja.kyoto.travel/tourism/single01.php?category_id=7&tourism_id=485,,open,広大な伽藍と多数の塔頭を擁する臨済宗妙心寺派の大本山,2026-07-21,京都市観光協会と施設公式サイトで名称・住所を確認
temple,jp-nara-kohfukuji,,temple|historic_site|world_heritage|national_treasure|landmark,法相宗大本山 興福寺,ほっそうしゅうだいほんざんこうふくじ,興福寺|Kohfukuji,奈良県,奈良市,奈良県奈良市登大路町48,,,https://www.kohfukuji.com/,https://www.visitnara.jp/venues/A00486/,,open,五重塔と阿修羅像で知られ古都奈良の世界遺産を構成する主要寺院,2026-07-21,奈良県観光公式サイトと施設公式サイトで名称・住所を確認
temple,jp-nara-yakushiji,,temple|historic_site|world_heritage|national_treasure|landmark,法相宗大本山 薬師寺,ほっそうしゅうだいほんざんやくしじ,薬師寺|Yakushiji,奈良県,奈良市,奈良県奈良市西ノ京町457,,,https://yakushiji.or.jp/,https://www.visitnara.jp/venues/A00499/,,open,東塔と薬師三尊で知られ古都奈良の世界遺産を構成する主要寺院,2026-07-21,奈良県観光公式サイトと施設公式サイトで名称・住所を確認
temple,jp-nara-toshodaiji,,temple|historic_site|world_heritage|national_treasure|landmark,律宗総本山 唐招提寺,りっしゅうそうほんざんとうしょうだいじ,唐招提寺|Toshodaiji,奈良県,奈良市,奈良県奈良市五条町13-46,,,https://toshodaiji.jp/,https://www.visitnara.jp/venues/A00500/,,open,鑑真ゆかりの金堂で知られ古都奈良の世界遺産を構成する寺院,2026-07-21,奈良県観光公式サイトと施設公式サイトで名称・住所を確認
temple,jp-nara-gangoji,,temple|historic_site|world_heritage|national_treasure|landmark,元興寺,がんごうじ,Gangoji,奈良県,奈良市,奈良県奈良市中院町11,,,https://gangoji-tera.or.jp/,https://www.visitnara.jp/venues/A00495/,,open,ならまちに位置し古都奈良の世界遺産を構成する古刹,2026-07-21,奈良県観光公式サイトと施設公式サイトで名称・住所を確認
temple,jp-nara-saidaiji,,temple|historic_site|landmark,真言律宗総本山 西大寺,しんごんりっしゅうそうほんざんさいだいじ,西大寺|Saidaiji,奈良県,奈良市,奈良県奈良市西大寺芝町1-1-5,,,https://saidaiji.or.jp/,https://www.visitnara.jp/venues/A00498/,,open,大茶盛式で知られる奈良西部の代表的寺院,2026-07-21,奈良県観光公式サイトと施設公式サイトで名称・住所を確認
temple,jp-nara-shinyakushiji,,temple|historic_site|national_treasure|landmark,新薬師寺,しんやくしじ,Shinyakushiji,奈良県,奈良市,奈良県奈良市高畑町1352,,,https://www.shinyakushiji.or.jp/,https://www.visitnara.jp/venues/A00496/,,open,国宝本堂と十二神将立像で知られる高畑の古刹,2026-07-21,奈良県観光公式サイトと施設公式サイトで名称・住所を確認
temple,jp-nara-akishinodera,,temple|historic_site|landmark,秋篠寺,あきしのでら,Akishinodera,奈良県,奈良市,奈良県奈良市秋篠町757,,,https://narashikanko.or.jp/spot/detail_10018.html,https://narashikanko.or.jp/spot/detail_10018.html,,open,伎芸天像と苔の境内で知られる奈良西部の古刹,2026-07-21,奈良市観光協会公式情報で名称・住所を確認
temple,jp-nara-daianji,,temple|historic_site|landmark,大安寺,だいあんじ,南都大安寺|Daianji,奈良県,奈良市,奈良県奈良市大安寺2-18-1,,,https://www.daianji.or.jp/,https://www.visitnara.jp/venues/E02045/,,open,南都七大寺の一つでがん封じ祈願でも知られる古刹,2026-07-21,奈良県観光公式サイトと施設公式サイトで名称・住所を確認
temple,jp-nara-hokkeji,,temple|historic_site|landmark,法華寺門跡,ほっけじもんぜき,法華寺|Hokkeji,奈良県,奈良市,奈良県奈良市法華寺町882,,,https://hokkeji-nara.jp/,https://narashikanko.or.jp/spot/detail_10014.html,,open,光明皇后ゆかりの総国分尼寺として知られる門跡寺院,2026-07-21,奈良市観光協会と施設公式サイトで名称・住所を確認
temple,jp-nara-hasedera,,temple|historic_site|national_treasure|landmark,総本山 長谷寺,そうほんざんはせでら,長谷観音|Hasedera,奈良県,桜井市,奈良県桜井市初瀬731-1,,,https://www.hasedera.or.jp/,https://www.visitnara.jp/venues/A00517/,,open,十一面観世音菩薩と花の御寺として全国的に知られる主要寺院,2026-07-21,奈良県観光公式サイトと施設公式サイトで名称・住所を確認
temple,jp-nara-muroji,,temple|historic_site|national_treasure|landmark,大本山 室生寺,だいほんざんむろうじ,女人高野|Muroji,奈良県,宇陀市,奈良県宇陀市室生78,,,https://www.murouji.or.jp/,https://www.visitnara.jp/venues/A00527/,,open,女人高野と山中の五重塔で知られる宇陀の代表寺院,2026-07-21,奈良県観光公式サイトと施設公式サイトで名称・住所を確認
temple,jp-nara-okadera,,temple|historic_site|landmark,東光山 岡寺（龍蓋寺）,とうこうざんおかでら,岡寺|龍蓋寺|Okadera,奈良県,高市郡明日香村,奈良県高市郡明日香村岡806,,,https://www.okadera3307.com/,https://www.visitnara.jp/venues/A00523/,,open,日本最初の厄除霊場として知られる明日香の代表寺院,2026-07-21,奈良県観光公式サイトと施設公式サイトで名称・住所を確認
temple,jp-nara-tachibanadera,,temple|historic_site|landmark,仏頭山上宮皇院 橘寺,ぶっとうざんじょうぐうおういんたちばなでら,橘寺|Tachibanadera,奈良県,高市郡明日香村,奈良県高市郡明日香村橘532,,,https://www.visitnara.jp/venues/A00856/,https://www.visitnara.jp/venues/A00856/,,open,聖徳太子生誕地と伝わる明日香の代表的古刹,2026-07-21,奈良県観光公式サイトで名称・住所を確認
temple,jp-nara-taimadera,,temple|historic_site|national_treasure|landmark,當麻寺,たいまでら,当麻寺|Taimadera,奈良県,葛城市,奈良県葛城市當麻1263,,,https://www.taimadera.org/,https://www.visitnara.jp/venues/A00511/,,open,當麻曼荼羅と東西両塔で知られる葛城地域の代表寺院,2026-07-21,奈良県観光公式サイトと施設公式サイトで名称・住所を確認
temple,jp-nara-kinpusenji,,temple|historic_site|world_heritage|national_treasure|sacred_site|landmark,金峯山修験本宗 総本山 金峯山寺,きんぷせんしゅげんほんしゅうそうほんざんきんぷせんじ,金峯山寺|蔵王堂|Kinpusenji,奈良県,吉野郡吉野町,奈良県吉野郡吉野町吉野山2498,,,https://www.kinpusen.or.jp/,https://www.visitnara.jp/venues/A00532/,,open,蔵王堂を中心に紀伊山地の霊場と参詣道を構成する世界遺産寺院,2026-07-21,奈良県観光公式サイトと施設公式サイトで名称・住所を確認
temple,jp-nara-chogosonshiji,,temple|historic_site|landmark,信貴山朝護孫子寺,しぎさんちょうごそんしじ,信貴山|朝護孫子寺|Chogosonshiji,奈良県,生駒郡平群町,奈良県生駒郡平群町信貴山2280-1,,,https://www.sigisan.or.jp/,https://www.visitnara.jp/venues/A00509/,,open,毘沙門天信仰と寅の張り子で知られる信貴山の代表寺院,2026-07-21,奈良県観光公式サイトと施設公式サイトで名称・住所を確認
temple,jp-nara-abemonjuin,,temple|historic_site|national_treasure|landmark,安倍文殊院,あべもんじゅいん,Abe Monjuin,奈良県,桜井市,奈良県桜井市阿部645,,,https://www.abemonjuin.or.jp/,https://www.visitnara.jp/venues/A00516/,,open,日本三文殊の一つで国宝文殊菩薩像を有する桜井の古刹,2026-07-21,奈良県観光公式サイトと施設公式サイトで名称・住所を確認
shrine,jp-nara-oomiwa-jinja,,shrine|historic_site|sacred_site|landmark,大神神社,おおみわじんじゃ,三輪明神|Omiwa Jinja,奈良県,桜井市,奈良県桜井市三輪1422,,,https://oomiwa.or.jp/,https://www.visitnara.jp/venues/A00515/,,open,三輪山を御神体とする日本最古級の神社として全国的に知られる,2026-07-21,奈良県観光公式サイトと施設公式サイトで名称・住所を確認
shrine,jp-nara-kashihara-jingu,,shrine|historic_site|landmark,橿原神宮,かしはらじんぐう,Kashihara Jingu,奈良県,橿原市,奈良県橿原市久米町934,,,https://kashiharajingu.or.jp/,https://www.visitnara.jp/venues/A00520/,,open,神武天皇を祀り畝傍山麓の広大な神域で知られる代表的神社,2026-07-21,奈良県観光公式サイトと施設公式サイトで名称・住所を確認
shrine,jp-nara-isonokami-jingu,,shrine|historic_site|national_treasure|landmark,石上神宮,いそのかみじんぐう,Isonokami Jingu,奈良県,天理市,奈良県天理市布留町384,,,https://www.isonokami.jp/,https://www.visitnara.jp/venues/A00513/,,open,日本最古級の神宮で国宝拝殿を有する天理の代表的神社,2026-07-21,奈良県観光公式サイトと施設公式サイトで名称・住所を確認
shrine,jp-tokyo-yasukuni-jinja,,shrine|historic_site|landmark,靖国神社,やすくにじんじゃ,Yasukuni Jinja,東京都,千代田区,東京都千代田区九段北3-1-1,,,https://www.yasukuni.or.jp/,https://www.gotokyo.org/jp/spot/466/index.html,,open,九段に位置し桜の標本木でも広く知られる東京の主要神社,2026-07-21,東京観光財団と施設公式サイトで名称・住所を確認
shrine,jp-tokyo-kanda-myojin,,shrine|historic_site|landmark,神田神社（神田明神）,かんだじんじゃ,神田明神|Kanda Myojin,東京都,千代田区,東京都千代田区外神田2-16-2,,,https://www.kandamyoujin.or.jp/,https://www.gotokyo.org/jp/spot/17/index.html,,open,神田祭と江戸総鎮守として知られる東京を代表する神社,2026-07-21,東京観光財団と施設公式サイトで名称・住所を確認
shrine,jp-tokyo-hie-jinja,,shrine|historic_site|landmark,日枝神社,ひえじんじゃ,山王さま|Hie Jinja,東京都,千代田区,東京都千代田区永田町2-10-5,,,https://www.hiejinja.net/,https://www.gotokyo.org/en/spot/343/index.html,,open,山王祭と千本鳥居で知られる赤坂・永田町の主要神社,2026-07-21,東京観光財団と施設公式サイトで名称・住所を確認
shrine,jp-tokyo-tokyo-daijingu,,shrine|historic_site|landmark,東京大神宮,とうきょうだいじんぐう,東京のお伊勢さま|Tokyo Daijingu,東京都,千代田区,東京都千代田区富士見2-4-1,,,https://www.tokyodaijingu.or.jp/,https://www.gotokyo.org/jp/spot/42/index.html,,open,東京のお伊勢さまとして親しまれ神前結婚式発祥でも知られる神社,2026-07-21,東京観光財団と施設公式サイトで名称・住所を確認
shrine,jp-tokyo-nezu-jinja,,shrine|historic_site|landmark,根津神社,ねづじんじゃ,Nezu Jinja,東京都,文京区,東京都文京区根津1-28-9,,,https://nedujinja.or.jp/,https://www.gotokyo.org/jp/spot/70/index.html,,open,つつじ苑と重要文化財の社殿で知られる東京十社の一社,2026-07-21,東京観光財団と施設公式サイトで名称・住所を確認
shrine,jp-tokyo-tomioka-hachimangu,,shrine|historic_site|landmark,富岡八幡宮,とみおかはちまんぐう,深川八幡|Tomioka Hachimangu,東京都,江東区,東京都江東区富岡1-20-3,,,https://www.tomiokahachimangu.or.jp/,https://www.city.koto.lg.jp/promotion/spot/tomioka.html,,open,深川八幡祭りと勧進相撲発祥地として知られる江戸最大の八幡宮,2026-07-21,江東区公式観光情報と施設公式サイトで名称・住所を確認
shrine,jp-tokyo-yushima-tenmangu,,shrine|historic_site|landmark,湯島天満宮,ゆしまてんまんぐう,湯島天神|Yushima Tenjin,東京都,文京区,東京都文京区湯島3-30-1,,,https://www.yushimatenjin.or.jp/,https://www.gotokyo.org/jp/spot/116/index.html,,open,学問の神と梅まつりで全国的に知られる東京の天満宮,2026-07-21,東京観光財団と施設公式サイトで名称・住所を確認
