catalogID,placeID,parentPlaceID,typeKeys,officialName,reading,aliases,prefecture,municipality,address,latitude,longitude,officialURL,sourceURL,capacity,status,selectionReason,verifiedAt,notes
landmark,jp-osaka-tsutenkaku,,tower|observation_deck|landmark,通天閣,つうてんかく,Tsutenkaku Tower|大阪のエッフェル塔,大阪府,大阪市浪速区,大阪府大阪市浪速区恵美須東1-18-6,,,https://www.tsutenkaku.co.jp/,https://tsutenkaku.co.jp/access/,,open,新世界を象徴し長年大阪のシンボルとして親しまれる展望塔,2026-07-21,公式交通アクセスで名称と住所を確認
landmark,jp-kanagawa-yokohama-red-brick-warehouse,,historic_building|cultural_facility|landmark,横浜赤レンガ倉庫,よこはまあかれんがそうこ,Yokohama Red Brick Warehouse|赤レンガ倉庫,神奈川県,横浜市中区,神奈川県横浜市中区新港1-1,,,https://www.yokohama-akarenga.jp/,https://www.yokohama-akarenga.jp/access/,,open,歴史的建造物と文化・商業イベントを兼ねる横浜港の代表的ランドマーク,2026-07-21,公式アクセスページで名称と住所を確認
landmark,jp-nagasaki-oura-church,,church|historic_site|world_heritage|landmark,国宝 大浦天主堂,こくほうおおうらてんしゅどう,大浦天主堂|Oura Cathedral|Oura Church,長崎県,長崎市,長崎県長崎市南山手町5-3,,,https://oura-church.jp/,https://oura-church.jp/guide/,,open,信徒発見の歴史を伝える国宝・世界遺産構成資産の代表的教会,2026-07-21,寺院カタログへ混在させず教会・史跡ランドマークとして登録
landmark,jp-okayama-okayama-korakuen,,garden|historic_site|landmark,岡山後楽園,おかやまこうらくえん,後楽園|Okayama Korakuen Garden,岡山県,岡山市北区,岡山県岡山市北区後楽園1-5,,,https://okayama-korakuen.jp/,https://okayama-korakuen.jp/rekishi/about/index.html,,open,日本三名園の一つで岡山城と一体的な来訪・景観記録需要が高い大名庭園,2026-07-21,公式サイトの所在地を保存
leisure,jp-miyagi-yagiyama-zoo,,zoo|leisure_facility,八木山動物公園フジサキの杜,やぎやまどうぶつこうえんふじさきのもり,仙台市八木山動物公園|Yagiyama Zoological Park,宮城県,仙台市太白区,宮城県仙台市太白区八木山本町1-43,,,https://www.city.sendai.jp/zoo/,https://www.city.sendai.jp/zoo/information/3-access.html,,open,東北最大都市の仙台で長く親しまれる地域を代表する動物園,2026-07-21,仙台市公式アクセスで名称と住所を確認
leisure,jp-tochigi-nasu-animal-kingdom,,zoo|leisure_facility,那須どうぶつ王国,なすどうぶつおうこく,Nasu Animal Kingdom|那須王国,栃木県,那須郡那須町,栃木県那須郡那須町大島1042-1,,,https://nasu-oukoku.com/,https://nasu-oukoku.com/?page_id=1598,,open,動物との近い距離感とショーで全国的な集客力を持つ動物テーマ施設,2026-07-21,公式サイト掲載の所在地を保存
leisure,jp-shizuoka-fuji-safari-park,,zoo|safari_park|leisure_facility,富士サファリパーク,ふじさふぁりぱーく,Fuji Safari Park,静岡県,裾野市,静岡県裾野市須山字藤原2255-27,,,https://www.fujisafari.co.jp/,https://www.fujisafari.co.jp/access/,,open,車や園内バスで動物を観察できる国内有数のサファリパーク,2026-07-21,公式アクセスで名称と住所を確認
leisure,jp-hyogo-kobe-oji-zoo,,zoo|leisure_facility,神戸市立王子動物園,こうべしりつおうじどうぶつえん,王子動物園|Kobe Oji Zoo,兵庫県,神戸市灘区,兵庫県神戸市灘区王子町3-1,,,https://kobe-ojizoo.jp/,https://www.kobe-ojizoo.jp/guide/index.html,,open,神戸市街地で幅広い世代に親しまれる関西の主要都市型動物園,2026-07-21,公式利用案内で名称と住所を確認
leisure,jp-ehime-tobe-zoo,,zoo|leisure_facility,愛媛県立とべ動物園,えひめけんりつとべどうぶつえん,とべ動物園|Tobe Zoological Park,愛媛県,伊予郡砥部町,愛媛県伊予郡砥部町上原町240,,,https://www.tobezoo.com/,https://www.tobezoo.com/kyokai/jigyo.html,,open,西日本有数の規模を持ち四国の広域来園需要を担う県立動物園,2026-07-21,運営協会公式ページで名称と住所を確認
leisure,jp-fukuoka-fukuoka-city-zoo,,zoo|leisure_facility,福岡市動物園,ふくおかしどうぶつえん,Fukuoka City Zoological Garden|福岡市動植物園,福岡県,福岡市中央区,福岡県福岡市中央区南公園1-1,,,https://zoo.city.fukuoka.lg.jp/,https://zoo.city.fukuoka.lg.jp/sp/general/general03,,open,福岡市中心部に近く動植物園として高い地域利用がある主要動物園,2026-07-21,公式交通案内で名称と住所を確認
leisure,jp-okinawa-okinawa-zoo-museum,,zoo|museum|leisure_facility,沖縄こどもの国,おきなわこどものくに,Okinawa Zoo & Museum|沖縄こどもの国Zoo,沖縄県,沖縄市,沖縄県沖縄市胡屋5-7-1,,,https://www.okzm.jp/,https://www.okzm.jp/access/,,open,動物園と体験型こども博物館を併設する沖縄県の代表的複合施設,2026-07-21,公式サイトの所在地と複合施設構成を確認
leisure,jp-hiroshima-asa-zoo,,zoo|leisure_facility,広島市安佐動物公園,ひろしましあさどうぶつこうえん,安佐動物公園|Asa Zoological Park,広島県,広島市安佐北区,広島県広島市安佐北区安佐町大字動物園,,,https://www.asazoo.jp/,https://www.asazoo.jp/info/access.php,,open,中国地方の中核都市で広域集客する大規模な公立動物園,2026-07-21,公式アクセスが番地を設けない所在地表記のためそのまま保存
leisure,jp-kanagawa-yomiuriland,,theme_park|leisure_facility,よみうりランド,よみうりらんど,Yomiuriland|読売ランド,神奈川県,川崎市多摩区,神奈川県川崎市多摩区菅仙谷4-1-1,,,https://www.yomiuriland.com/,https://www.yomiuriland.com/traffic/,,open,首都圏からのアクセスと季節イベントで高い集客力を持つ総合遊園地,2026-07-21,東京都と神奈川県にまたがる施設のため公式来園者向け住所を採用
leisure,jp-mie-shima-spain-village,,theme_park|leisure_facility,志摩スペイン村 パルケエスパーニャ,しますぺいんむらぱるけえすぱーにゃ,パルケエスパーニャ|Parque España|Shima Spain Village,三重県,志摩市,三重県志摩市磯部町坂崎,,,https://www.parque-net.com/,https://www.parque-net.com/information/qa.html,,open,スペイン文化をテーマに宿泊施設も備える東海・近畿圏の主要テーマパーク,2026-07-21,公式サイトが番地なしで掲載する所在地をそのまま保存
leisure,jp-kumamoto-greenland,,theme_park|leisure_facility,グリーンランド,ぐりーんらんど,Greenland|グリーンランド遊園地|三井グリーンランド,熊本県,荒尾市,熊本県荒尾市緑ヶ丘,,,https://www.greenland.co.jp/park/,https://www.greenland.co.jp/park/access/,,open,多数のアトラクションを持ち九州北部から広域集客する大型遊園地,2026-07-21,公式サイトが番地なしで掲載する遊園地所在地を保存
leisure,jp-kagawa-new-reoma-world,,theme_park|leisure_facility,NEWレオマワールド,にゅーれおまわーるど,ニューレオマワールド|NEW REOMA WORLD|レオマリゾート,香川県,丸亀市,香川県丸亀市綾歌町栗熊西40-1,,,https://www.newreomaworld.com/,https://www.newreomaworld.com/company/,,open,四国最大級の遊園地として季節イベントと宿泊を含む広域需要がある,2026-07-21,公式会社概要で名称と所在地を確認
leisure,jp-tochigi-tobu-world-square,,theme_park|leisure_facility,東武ワールドスクウェア,とうぶわーるどすくうぇあ,TOBU WORLD SQUARE|東武ワールドスクエア,栃木県,日光市,栃木県日光市鬼怒川温泉大原209-1,,,https://www.tobuws.co.jp/,https://www.tobuws.co.jp/lp03/,,open,世界の建築物を精巧な縮尺模型で巡れる日光・鬼怒川の著名テーマパーク,2026-07-21,公式案内で名称と住所を確認
leisure,jp-saitama-moominvalley-park,,theme_park|leisure_facility,ムーミンバレーパーク,むーみんばれーぱーく,MOOMINVALLEY PARK|メッツァ,埼玉県,飯能市,埼玉県飯能市宮沢327-6 メッツァ,,,https://metsa-hanno.com/Moominvalleypark/,https://metsa-hanno.com/access/,,open,ムーミン作品世界を体験でき首都圏から継続的な来園需要があるテーマパーク,2026-07-21,公式アクセス掲載のメッツァ所在地を保存
leisure,jp-tochigi-edo-wonderland,,theme_park|cultural_facility|leisure_facility,江戸ワンダーランド 日光江戸村,えどわんだーらんどにっこうえどむら,日光江戸村|EDO WONDERLAND,栃木県,日光市,栃木県日光市柄倉470-2,,,https://edowonderland.net/,https://edowonderland.net/access/,,open,江戸文化の町並みと体験を一体化した国内を代表する歴史テーマパーク,2026-07-21,公式アクセスで名称と住所を確認
leisure,jp-kanagawa-hakkeijima-sea-paradise,,aquarium|theme_park|leisure_facility,横浜・八景島シーパラダイス,よこはまはっけいじましーぱらだいす,八景島シーパラダイス|シーパラ|YOKOHAMA HAKKEIJIMA SEA PARADISE,神奈川県,横浜市金沢区,神奈川県横浜市金沢区八景島,,,https://www.seaparadise.co.jp/,https://www.seaparadise.co.jp/access/index.html,,open,複数水族館と遊園地を一体で楽しめる首都圏の大規模複合レジャー施設,2026-07-21,公式アクセスが番地を設けない島名所在地のためそのまま保存
landmark,jp-ibaraki-kairakuen,,garden|park|historic_site|landmark,偕楽園,かいらくえん,Kairakuen Garden|日本三名園,茨城県,水戸市,茨城県水戸市常磐町1-3-3,,,https://ibaraki-kairakuen.jp/,https://ibaraki-kairakuen.jp/access/,,open,日本三名園の一つで梅を中心に四季の景観記録需要が高い歴史庭園,2026-07-21,公式アクセスで名称と住所を確認
leisure,jp-tochigi-ashikaga-flower-park,,botanical_garden|garden|leisure_facility,あしかがフラワーパーク,あしかがふらわーぱーく,ASHIKAGA FLOWER PARK|足利フラワーパーク,栃木県,足利市,栃木県足利市迫間町607,,,https://www.ashikaga.co.jp/,https://www.ashikaga.co.jp/sp/access.html,,open,大藤と季節の花景観で国内外から来園者を集める代表的フラワーパーク,2026-07-21,公式アクセスで名称と住所を確認
landmark,jp-ibaraki-hitachi-seaside-park,,park|garden|landmark,国営ひたち海浜公園,こくえいひたちかいひんこうえん,国営常陸海浜公園|Hitachi Seaside Park|ひたち海浜公園,茨城県,ひたちなか市,茨城県ひたちなか市馬渡字大沼605-4,,,https://www.hitachikaihin.jp/,https://www.hitachikaihin.jp/access/,,open,ネモフィラやコキアの広大な季節景観で全国的な来園需要がある国営公園,2026-07-21,公式アクセスで名称と住所を確認
landmark,jp-kagawa-ritsurin-garden,,garden|park|historic_site|landmark,特別名勝 栗林公園,とくべつめいしょうりつりんこうえん,栗林公園|Ritsurin Garden,香川県,高松市,香川県高松市栗林町1-20-16,,,https://www.my-kagawa.jp/ritsuringarden,https://www.my-kagawa.jp/ritsuringarden/feature/ritsuringarden/access,,open,特別名勝に指定され四国を代表する回遊式大名庭園,2026-07-21,香川県公式観光サイトで名称と住所を確認
museum,jp-akita-akita-museum-of-art,,art_museum|museum|cultural_facility,秋田県立美術館,あきたけんりつびじゅつかん,Akita Museum of Art|平野政吉美術館,秋田県,秋田市,秋田県秋田市中通1-4-2,,,https://www.akita-museum-of-art.jp/,https://www.akita-museum-of-art.jp/smp/access.htm,,open,藤田嗣治の大壁画と安藤忠雄設計の建築で知られる秋田の主要美術館,2026-07-21,公式アクセスで名称と住所を確認
museum,jp-iwate-iwate-museum-of-art,,art_museum|museum|cultural_facility,岩手県立美術館,いわてけんりつびじゅつかん,Iwate Museum of Art|IMA,岩手県,盛岡市,岩手県盛岡市本宮字松幅12-3,,,https://www.ima.or.jp/,https://www.ima.or.jp/information/162-access.html,,open,岩手ゆかりの作家を軸に地域美術を継続的に発信する県立美術館,2026-07-21,公式アクセスで名称と住所を確認
museum,jp-yamagata-yamagata-museum-of-art,,art_museum|museum|cultural_facility,山形美術館,やまがたびじゅつかん,Yamagata Museum of Art,山形県,山形市,山形県山形市大手町1-63,,,https://www.yamagata-art-museum.or.jp/,https://www.yamagata-art-museum.or.jp/contact,,open,フランス美術と東洋日本美術の充実した収蔵で知られる山形の主要美術館,2026-07-21,公式問い合わせページで名称と住所を確認
museum,jp-gunma-museum-modern-art-gunma,,art_museum|museum|cultural_facility,群馬県立近代美術館,ぐんまけんりつきんだいびじゅつかん,The Museum of Modern Art Gunma|群馬近美,群馬県,高崎市,群馬県高崎市綿貫町992-1 群馬の森公園内,,,https://mmag.pref.gunma.jp/,https://mmag.pref.gunma.jp/access,,open,国内外の近現代美術と磯崎新設計の建築で知られる北関東の主要美術館,2026-07-21,設備更新工事による長期休館中だが現役施設のためカタログ状態はopen
museum,jp-hiroshima-peace-memorial-museum,,museum|historic_site|cultural_facility,広島平和記念資料館,ひろしまへいわきねんしりょうかん,Hiroshima Peace Memorial Museum|原爆資料館,広島県,広島市中区,広島県広島市中区中島町1-2,,,https://hpmmuseum.jp/,https://www.city.hiroshima.lg.jp/atomicbomb-peace/1036658/1021119/1026964/1020985.html,,open,被爆の実相と平和を伝え国内外から多数が訪れる広島の中核資料館,2026-07-21,広島市公式アクセスで名称と住所を確認
museum,jp-nagasaki-atomic-bomb-museum,,museum|historic_site|cultural_facility,長崎原爆資料館,ながさきげんばくしりょうかん,Nagasaki Atomic Bomb Museum|原爆資料館,長崎県,長崎市,長崎県長崎市平野町7-8,,,https://nabmuseum.jp/,https://nabmuseum.jp/genbaku/,,open,長崎への原爆投下と被爆の実相を伝える国内外で重要な平和資料館,2026-07-21,公式施設案内で名称と住所を確認
leisure,jp-chiba-kamogawa-sea-world,,aquarium|museum|leisure_facility,鴨川シーワールド,かもがわしーわーるど,Kamogawa Sea World|鴨シー,千葉県,鴨川市,千葉県鴨川市東町1464-18,,,https://www.kamogawa-seaworld.jp/,https://www.kamogawa-seaworld.jp/access/route/,,open,大型海洋動物の展示とパフォーマンスで全国的に知られる水族館テーマパーク,2026-07-21,公式アクセスで名称と住所を確認
leisure,jp-shimane-shimane-aquarium-aquas,,aquarium|museum|leisure_facility,島根県立しまね海洋館アクアス,しまねけんりつしまねかいようかんあくあす,アクアス|Shimane Aquarium AQUAS,島根県,浜田市,島根県浜田市久代町1117-2,,,https://aquas.or.jp/,https://aquas.or.jp/guide/about/,,open,シロイルカ展示で知られ中国地方西部の広域来館需要を担う県立水族館,2026-07-21,公式施設概要で正式名称と住所を確認
leisure,jp-kagawa-shikoku-aquarium,,aquarium|museum|leisure_facility,四国水族館,しこくすいぞくかん,Shikoku Aquarium|四国水景,香川県,綾歌郡宇多津町,香川県綾歌郡宇多津町浜一番丁4,,,https://shikoku-aquarium.jp/,https://shikoku-aquarium.jp/ticket/,,open,四国の水景をテーマに瀬戸内海と太平洋の生態を伝える主要水族館,2026-07-21,公式サイトで名称と住所を確認
leisure,jp-oita-umitamago,,aquarium|museum|leisure_facility,大分マリーンパレス水族館「うみたまご」,おおいたまりーんぱれすすいぞくかんうみたまご,うみたまご|Oita Marine Palace Aquarium Umitamago,大分県,大分市,大分県大分市大字神崎字ウト3078-22,,,https://www.umitamago.jp/,https://www.umitamago.jp/access,,open,海獣展示と近距離体験で九州内外から来館者を集める大分の代表的水族館,2026-07-21,公式アクセスで正式名称と住所を確認
leisure,jp-kagoshima-kagoshima-city-aquarium,,aquarium|museum|leisure_facility,いおワールドかごしま水族館,いおわーるどかごしますいぞくかん,かごしま水族館|Kagoshima City Aquarium|いおワールド,鹿児島県,鹿児島市,鹿児島県鹿児島市本港新町3-1,,,https://ioworld.jp/,https://ioworld.jp/,,open,錦江湾から南西諸島の生き物を展示する南九州の代表的水族館,2026-07-21,公式サイトで名称と住所を確認
landmark,jp-tokyo-showa-kinen-park,,park|garden|landmark,国営昭和記念公園,こくえいしょうわきねんこうえん,昭和記念公園|Showa Kinen Park,東京都,立川市,東京都立川市緑町3173,,,https://www.showakinen-koen.jp/,https://www.showakinen-koen.jp/access/,,open,四季の花景観と大規模な緑地を持ち首都圏で高い再訪需要がある国営公園,2026-07-21,立川市と昭島市にまたがるため公式管理センター所在地を保存
leisure,jp-kyoto-kyoto-botanical-gardens,,botanical_garden|garden|leisure_facility,京都府立植物園,きょうとふりつしょくぶつえん,Kyoto Botanical Gardens|京都植物園,京都府,京都市左京区,京都府京都市左京区下鴨半木町,,,https://www.kyotobotanicalgardens.jp/,https://www.pref.kyoto.jp/plant/access.html,,open,日本最古の公立総合植物園として多様な植物と季節景観を楽しめる主要施設,2026-07-21,京都府公式アクセスで名称と住所を確認
leisure,jp-tottori-tottori-hanakairou,,botanical_garden|garden|leisure_facility,鳥取県立 とっとり花回廊,とっとりけんりつとっとりはなかいろう,とっとり花回廊|Tottori Hanakairo Flower Park,鳥取県,西伯郡南部町,鳥取県西伯郡南部町鶴田110,,,https://www.tottorihanakairou.or.jp/,https://tottorihanakairou.or.jp/park/gaiyo/,,open,大山を望む国内最大級のフラワーパークで中国地方の季節景観需要が高い,2026-07-21,公式施設概要で県立を含む名称と住所を確認
leisure,jp-shizuoka-hamamatsu-flower-park,,botanical_garden|garden|leisure_facility,はままつフラワーパーク,はままつふらわーぱーく,Hamamatsu Flower Park|浜松フラワーパーク,静岡県,浜松市中央区,静岡県浜松市中央区舘山寺町195,,,https://e-flowerpark.com/,https://e-flowerpark.com/info/,,open,桜とチューリップをはじめ四季の花景観で知られる浜名湖畔の主要施設,2026-07-21,公式施設概要で名称と住所を確認
leisure,jp-kochi-makino-botanical-garden,,botanical_garden|garden|leisure_facility,高知県立牧野植物園,こうちけんりつまきのしょくぶつえん,牧野植物園|The Kochi Prefectural Makino Botanical Garden,高知県,高知市,高知県高知市五台山4200-6,,,https://www.makino.or.jp/,https://www.makino.or.jp/fixed/?page_key=guide,,open,牧野富太郎の業績と四国の植物多様性を伝える全国的に著名な植物園,2026-07-21,公式園内ガイドで名称と住所を確認
leisure,jp-osaka-hirakata-park,,theme_park|leisure_facility,ひらかたパーク,ひらかたぱーく,Hirakata Park|ひらパー,大阪府,枚方市,大阪府枚方市枚方公園町1-1,,,https://www.hirakatapark.co.jp/,https://www.hirakatapark.co.jp/company/,,open,長い歴史と地域密着の愛称で親しまれる関西を代表する中規模遊園地,2026-07-21,公式運営会社ページで名称と住所を確認
leisure,jp-aichi-japan-monkey-park,,theme_park|leisure_facility,日本モンキーパーク,にほんもんきーぱーく,Japan Monkey Park|モンパ,愛知県,犬山市,愛知県犬山市大字犬山字官林26,,,https://www.japan-monkeypark.jp/,https://www.japan-monkeypark.jp/access/,,open,遊具と季節イベントで東海圏の家族利用が多い歴史ある遊園地,2026-07-21,隣接する日本モンキーセンターとは別施設として登録
leisure,jp-tochigi-nasu-highland-park,,theme_park|leisure_facility,那須ハイランドパーク,なすはいらんどぱーく,NASU HIGHLAND PARK|那須ハイ,栃木県,那須郡那須町,栃木県那須郡那須町高久乙3375,,,https://www.nasuhai.co.jp/,https://www.nasuhai.co.jp/,,open,那須高原の観光と一体で利用され多数の乗り物を持つ東日本の主要遊園地,2026-07-21,公式サイトで名称と住所を確認
leisure,jp-chiba-tokyo-german-village,,theme_park|garden|leisure_facility,東京ドイツ村,とうきょうどいつむら,Tokyo German Village|ドイツ村,千葉県,袖ケ浦市,千葉県袖ケ浦市永吉419,,,https://t-doitsumura.co.jp/,https://t-doitsumura.co.jp/access/,,open,広大な花畑と冬季イルミネーションで高い季節再訪需要があるテーマパーク,2026-07-21,名称に東京を含むが所在地は千葉県袖ケ浦市として登録
museum,jp-fukushima-fukushima-museum,,museum|historic_site|cultural_facility,福島県立博物館,ふくしまけんりつはくぶつかん,Fukushima Museum|福島県博,福島県,会津若松市,福島県会津若松市城東町1-25,,,https://general-museum.fcs.ed.jp/,https://www.pref.fukushima.lg.jp/sec/70016a/hakubutukannntourokuosirase.html,,open,会津を中心に福島県の歴史・民俗・自然を総合的に伝える県立博物館,2026-07-21,福島県公式の登録博物館情報で名称と住所を確認
museum,jp-ibaraki-ibaraki-nature-museum,,museum|science_museum|cultural_facility,ミュージアムパーク 茨城県自然博物館,みゅーじあむぱーくいばらきけんしぜんはくぶつかん,茨城県自然博物館|Ibaraki Nature Museum|ミュージアムパーク,茨城県,坂東市,茨城県坂東市大崎700,,,https://www.nat.museum.ibk.ed.jp/,https://www.nat.museum.ibk.ed.jp/information/access,,open,大型展示と野外施設を併せ持ち家族利用の多い関東有数の自然史博物館,2026-07-21,公式アクセスで名称と住所を確認
museum,jp-saitama-history-folklore-museum,,museum|historic_site|cultural_facility,埼玉県立歴史と民俗の博物館,さいたまけんりつれきしとみんぞくのはくぶつかん,Saitama Prefectural Museum of History and Folklore|埼玉歴民,埼玉県,さいたま市大宮区,埼玉県さいたま市大宮区高鼻町4-219,,,https://saitama-rekimin.spec.ed.jp/,https://saitama-rekimin.spec.ed.jp/english,,open,埼玉の歴史・民俗・美術を横断し大宮公園内で利用される主要県立博物館,2026-07-21,公式サイトで名称と住所を確認
museum,jp-kanagawa-earth-science-museum,,museum|science_museum|cultural_facility,神奈川県立 生命の星・地球博物館,かながわけんりつせいめいのほしちきゅうはくぶつかん,生命の星・地球博物館|Kanagawa Prefectural Museum of Natural History,神奈川県,小田原市,神奈川県小田原市入生田499,,,https://nh.kanagawa-museum.jp/,https://nh.kanagawa-museum.jp/visit/access.html,,open,地球史と生命多様性を多数の実物標本で伝える全国有数の自然史博物館,2026-07-21,公式交通案内で名称と住所を確認
museum,jp-toyama-toyama-prefectural-museum-art-design,,art_museum|museum|cultural_facility,富山県美術館,とやまけんびじゅつかん,Toyama Prefectural Museum of Art and Design|TAD,富山県,富山市,富山県富山市木場町3-20,,,https://tad-toyama.jp/,https://tad-toyama.jp/visitor/access,,open,アートとデザインを軸に建築や屋上空間も含めて親しまれる富山の主要美術館,2026-07-21,公式アクセスで名称と住所を確認
museum,jp-yamanashi-yamanashi-prefectural-museum-art,,art_museum|museum|cultural_facility,山梨県立美術館,やまなしけんりつびじゅつかん,Yamanashi Prefectural Museum of Art|ミレーの美術館,山梨県,甲府市,山梨県甲府市貢川1-4-27,,,https://www.art-museum.pref.yamanashi.jp/,https://www.art-museum.pref.yamanashi.jp/2025.4.1.cg.pdf,,open,ミレー作品群で全国的に知られ山梨の芸術文化拠点となる県立美術館,2026-07-21,公式施設利用案内で名称と住所を確認
museum,jp-nagano-nagano-prefectural-art-museum,,art_museum|museum|cultural_facility,長野県立美術館,ながのけんりつびじゅつかん,Nagano Prefectural Art Museum|NAM|東山魁夷館,長野県,長野市,長野県長野市箱清水1-4-4,,,https://nagano.art.museum/,https://nagano.art.museum/access,,open,善光寺東隣で本館と東山魁夷館を巡れる長野県の主要美術館,2026-07-21,公式アクセスで名称と住所を確認
museum,jp-gifu-museum-fine-arts-gifu,,art_museum|museum|cultural_facility,岐阜県美術館,ぎふけんびじゅつかん,The Museum of Fine Arts Gifu|岐阜県美,岐阜県,岐阜市,岐阜県岐阜市宇佐4-1-22,,,https://kenbi.pref.gifu.lg.jp/,https://kenbi.pref.gifu.lg.jp/visitor/access/,,open,ルドンと岐阜ゆかりの作家の充実した収蔵で知られる県立美術館,2026-07-21,公式アクセスで名称と住所を確認
